{"$schema":"https://json-schema.org/draft/2020-12/schema","title":"Mint Journey OS issue","type":"object","additionalProperties":false,"required":["schema_version","id","title","journey_id","status","owner","severity","evidence_status","next_action","source"],"properties":{"schema_version":{"const":1},"id":{"type":"string","pattern":"^JOS-[0-9]{3}$"},"title":{"type":"string","minLength":1},"journey_id":{"type":"string","minLength":1},"status":{"enum":["found","triaged","assigned","fixing","proof_needed","verified","merged","regressed","blocked"]},"owner":{"enum":["mint-lead","mint-quality-gate","mint-mobile","mint-backend","mint-swiss-brain"]},"severity":{"enum":["P0","P1","P2","P3"]},"evidence_status":{"enum":["green","red","missing","baselined"]},"next_action":{"type":"string","minLength":20},"source":{"type":"string","minLength":1}}}
