{
  "schema_version": 1,
  "id": "JOS-010",
  "title": "Clean runtime proof labels and debug exposure",
  "journey_id": "mint_lucidity_p0_acceptance",
  "status": "triaged",
  "owner": "mint-mobile",
  "severity": "P3",
  "evidence_status": "baselined",
  "next_action": "Before broader QA handoff, remap pending maestroFlowId labels to the Patrol flow id and review proof-strip visibility so debug builds do not expose misleading internal labels.",
  "source": "Claude Phase 2 refresh audit M3/M4: .planning/journeys/evidence/mint_dataquest_clean/20260704T192529Z-claude-phase2-refresh/claude-phase2-refresh.md."
}
