{
  "schema_version": 1,
  "id": "JOS-005",
  "title": "Restore onboarding first value before account gate",
  "journey_id": "onboarding_first_value",
  "status": "regressed",
  "owner": "mint-mobile",
  "severity": "P0",
  "evidence_status": "red",
  "next_action": "Fix the Mint2 LPP/rente-capital first-value path so selecting the live axis reaches /rente-vs-capital before account creation, then rerun the iPhone 13 mini Mint2 quality gate.",
  "source": "Mint2 quality gate 20260627T175336Z; flow_mint2_first_experience_rente_capital_entry.yaml"
}
