{
  "schema_version": 1,
  "id": "JOS-009",
  "title": "Collect pay frequency with housing costs",
  "journey_id": "mint_lucidity_p0_acceptance",
  "status": "verified",
  "owner": "mint-quality-gate",
  "severity": "P2",
  "evidence_status": "green",
  "next_action": "Keep housing-cost period metadata scoped to q_housing_cost_frequency and do not reuse q_pay_frequency outside income-period amounts.",
  "source": "Fixed by separating q_housing_cost_frequency from income-only q_pay_frequency; proven by targeted Flutter tests and iPhone 17 Pro Patrol evidence at .planning/journeys/evidence/mint_dataquest_clean/20260704T200804Z-jos009-budget-frequency-patrol/xcresult-summary.json."
}
